datetime,results,news_text,text
2022-06-19 18:15:27.149608,60938,"{3.361687183380127,1.964093804359436,3.098646402359009,3.6465530395507812}",経済産業省は公園や病院などへのアート作品の普及を後押しする。地方自治体や企業に建設費などの1%ほどを振り向けてもらうことをめざし、有識者会議で作品の購入を促す仕組みづくりを議論する。新型コロナウイルス禍で打撃を受けた芸術の活性化をめざす。公共建築などの建設費の一定比率を芸術にあてる「パーセント・フォー・アート」と呼ぶ活動を広げる。フランスや米国の一部の州では、駅や大学などの建設費のうち1%前後...
2022-06-19 18:15:27.149608,60939,"{3.1716864109039307,1.7923587560653687,2.590163230895996,2.780442714691162}",バレーボールのネーションズリーグ女子は19日、フィリピンのケソンなどで1次リーグが行われ、日本は中国に3-1で勝ち、開幕8連勝とした。古賀（NEC）が22得点の活躍を見せた。〔共同〕
2022-06-19 18:15:27.149608,60940,"{2.035508155822754,2.3762247562408447,2.655773639678955,2.029162883758545}",東京都内の一部公立小学校のPTAでつくる「東京都小学校PTA協議会」の定時総会が18日に開かれ、全国組織の「日本PTA全国協議会」から来年3月末に脱会する方向で手続きを進めることを賛成多数で了承した。東京都小学校PTA協議会によると、会員の意見があまり反映されず、会費が有効活用されていないことなどが脱会理由となっている。この日は、総会出席者の8割以上が賛成した。ただ、他の道府県組織とのつながりが失われることや、文部科学省へ意見が届きにくくなるのではないかといった懸念も示されたという。総会後に取材に応じた岡部健作会長は「会員が現場で役に立つと感じてくれるような、自分たちが真にやりたい事業に注力していくための判断だ」と説明した。7月の理事会で脱会が正式に決まる見通し。〔共同〕
2022-06-19 18:15:27.149608,60941,"{3.0469741821289062,1.7737349271774292,2.512659788131714,2.6002867221832275}",「負けから学べ」とはスポーツの世界でよく言われるが、勝ち続けながら学べればなおさら良い。昨夏の東京五輪以来の実戦でも、変わらぬ強さを見せた須崎はその好例だろう。「課題をたくさん得ることができた」。勝って反省を口にした22歳の表情は充実感にあふれていた。昨年の世界選手権を制した吉元玲美那（至学館大）との決勝。巧みに背後を取って4点のリードを奪う。だが第2ピリオド、代表入りへ意地を見せる相手にタッ...
2022-06-19 18:15:27.149608,60942,"{2.065911293029785,2.060791492462158,2.0963125228881836,2.230036497116089}",▽6時58分　公邸発。▽7時12分　東京・台場のフジテレビ。30分　報道番組に出演。▽8時54分　東京・神田猿楽町の明大米沢嘉博記念図書館・現代マンガ図書館。柳谷孝明大理事長と面会。視察。▽9時49分　漫画家と車座で意見交換。▽10時47分　公邸。▽13時15分　東京・芝公園のホテル「ザ・プリンスパークタワー東京」。宴会場「コンベンションホール」で「令和国民会議」（令和臨調）の発足大会に出席し、講演。▽14時44分　公邸。▽16時10分　官邸。11分　報道各社のインタビュー。13分　松野、木原、栗生正副官房長官、大野内閣府副大臣、村田内閣危機管理監。28分　報道各社のインタビュー。30分　公邸。
2022-06-19 18:15:27.149608,60943,"{1.9193060398101807,2.831176996231079,3.264643907546997,2.6016945838928223}",世界最大の小麦輸入国エジプトが国産小麦の増産を急いでいる。ロシアのウクライナ侵攻で両国に8割を頼っていた輸入小麦の調達がにわかに難しくなり、自給率の向上を迫られている。小麦の確保は、手厚い補助金で庶民にパンを安く届ける仕組みの大前提。主食を割安に供給する重圧が政権を突き動かしている。6月初め、首都カイロ近郊のギザにある集荷所に、周辺の農家が収穫したての小麦の袋を続々と運び込んでいた。「小麦は畑...
2022-06-19 18:15:27.149608,60944,"{3.2296576499938965,1.882926344871521,2.9357471466064453,3.097010612487793}",最初に端末操作一つで家に来てくれたのは配車アプリ「ウーバー」の運転手だった。今ではビスケットや鎮痛剤を自宅に届けてくれる人たちもいる。最短10分で日用品を配達するアプリも続々登場し、その魅力は抗しがたい。いつでも要求に応えてくれるオンデマンド型のアプリを使えば、誰もが使用人に物を頼むぜいたくを味わえるようになった。もっとも要望に応じてくれるのは毎回見知らぬ「使用人」で、再び顔を合わせる機会は多...
2022-06-19 18:15:27.149608,60945,"{1.9649863243103027,1.7367156744003296,1.9205427169799805,2.1340579986572266}",宮津市長（京都府）当　6318城崎　雅文　無現2621長林　三代　無新〔共同〕
2022-06-19 18:15:27.149608,60946,"{1.957651138305664,1.7418066263198853,1.8986568450927734,2.1346797943115234}",苫小牧市長（北海道）当29523岩倉　博文　無現17412西村　俊寛　無新〔共同〕
2022-06-19 18:15:27.149608,60947,"{2.5752251148223877,2.084972858428955,2.783797025680542,2.7053749561309814}",デジタルを軸に新しいテクノロジーがめまぐるしいスピードで生まれている。昨日までの知識はあっという間に陳腐化する。そんな時代に、企業にとっても働く人にとっても新しいスキルを身につける「リスキリング（学び直し）」が、生き残りの条件となってきた。企業や人が取り組むリスキリングの最前線で何が起きているのか。第1回は宅配の先駆者、ヤマト運輸のデジタル改革の現場に迫る。「入社当初は今の仕事をしている姿は全...
2022-06-19 18:15:27.149608,60948,"{2.1289830207824707,2.6944098472595215,3.2474586963653564,2.337733507156372}",企業が偽ブランド品など模倣品対策を相次ぎ強化している。ピジョンはQRコードで正規品かどうかを判別できる仕組みを導入し、パナソニックホールディングス（HD）は動画サイトの監視を始めた。新型コロナウイルス下で拡大した電子商取引（EC）でも流通が増え、ブランドの毀損にもつながる模倣品の対策が急務となっている。模倣品は主に中国などの業者が製造し、日本の税関が輸入を差し止...
2022-06-19 18:15:27.149608,60949,"{2.8474931716918945,2.3207216262817383,3.342083692550659,3.4559519290924072}",米IT（情報技術）大手のグーグルやIBMが主導してきた次世代の高速計算機、量子コンピューターの開発競争に地殻変動が起きている。独自技術で巨人の牙城に挑む新興企業が台頭し、中国勢も追い上げる。量子コンピューターは将来、100兆円規模の経済効果を生む可能性を秘める。化学、金融などの分野でその果実を巡る主導権争いも熱を帯びてきた。「量子を中心とするスーパーコンピューター時代をリードする」。IBMは5...
2022-06-19 18:15:27.149608,60950,"{1.9385740756988525,2.497356653213501,2.9629690647125244,2.2232654094696045}",通信会社と自動車メーカーなど異業種での特許交渉が増えている。特許に関する考え方が違って難航する例も多いとされ、日本政府などは交渉を円滑にするための指針や手引の整備を進める。だが複数の指針が並立し、海外の判例による実務上のルール形成も進むなど状況は複雑だ。企業側に「何を頼りにしていいのか分かりづらい」と戸惑いも広がっている。フィンランドのノキアやNTTといった通信大手など約50社...
2022-06-19 18:15:27.149608,60951,"{3.283299207687378,2.4263927936553955,3.3643765449523926,3.1099414825439453}",MS&ADインシュアランスグループホールディングスは年内に自動車事故の発生リスクを予測する危険度マップを開発する。都市開発で新たにできた道路や人流が大きく変化した交差点など事故が発生していない場所でも人工知能（AI）を使って発生率を予測できるようにする。主に市町村に提供する「地図リポート」を通じて、小学校の通学路や人混みの中の危険度をきめ細かく警告する。AIを使った危険度マップはMS&ADイン...
2022-06-19 18:15:27.149608,60952,"{2.7212908267974854,2.2476682662963867,2.8744425773620605,2.801074743270874}",医療制度と医療サービスの提供体制の改革は、古くて新しい国家的課題である。日本経済新聞社と日本経済研究センターは医療改革研究会を創設し、深刻な感染症のパンデミック（世界的大流行）のような有事は当然として、平時から患者が真に満足できる医療サービスを受けられるようにするための緊急提言を本年2月にまとめた。政府・地方自治体が保険医療機関にガバナンスを働かせる仕組みと、デジタル技術を活用して医療体制を再...
2022-06-19 18:15:27.149608,60953,"{2.9945003986358643,1.799723505973816,3.184072256088257,3.176351308822632}",タイ・バンコク近郊のスワンナプーム国際空港から車で約15分。地元住民向け商業施設の駐車場を進むと、突如としてジャンボジェット機が姿を現す。旅客機として実際に使われていた中古機材を改造した「747カフェ」は、手軽に旅行気分を味わえるスポットとして人気だ。機体の足元にあるチケット売り場で1人120バーツ（約460円）の「搭乗券」を購入し、タラップを上って機内に入る。近未来的なデザインに改装された室...
2022-06-19 18:15:27.149608,60954,"{1.8995554447174072,2.044710397720337,2.016970634460449,2.1637072563171387}",ウクライナに侵攻したロシアからのガス調達の削減を急ぐ欧州に対し、アフリカの天然ガス生産国が供給を増やそうとしている。米国などと比べて地理的に近く輸送費を抑えられる利点を生かし、アフリカのエネルギー大手が欧州の主要国と相次いで接近する。ただアフリカは政情不安のリスクも高く、中長期で安定してガスを開発・供給するための課題は少なくない。「欧州市場へのガス供給に関心を持っている」。西アフリカのセネガルのサル大統領は5月、同国を訪れたドイツのショルツ首相と会談後、強調した。ショルツ氏は就任後初のアフリカ訪問で「セネガルを最初の滞在地に意識的に選んだ」と述べ、エネルギー開発への支援や投資を話し合ったと明らかにした。セネガルは沖合の大西洋で大規模ガス田がみつかり、英石油大手BPが2017年に開発に参入した。23年にも液化天然ガス（LNG）の生産を始める。米国産LNGに比べ欧州への船賃の安さが期待され、有望な供給国に急浮上している。欧州市場を見据える動きは目立っている。4月にはアフリカ最大の産ガス国、アルジェリアの国営炭化水素公社とイタリア炭化水素公社（ENI）が契約を交わし、アルジェリアはイタリア向けに天然ガスの供給拡大を進める。ドラギ伊首相はロシアへの依存を減らすという「戦略的目標に対する重要な答えだ」と指摘した。ENIはエジプトのガス生産、LNG輸出の拡大についても、エジプトガス公社と合意したほか、コンゴ共和国ともガス供給増に向けて基本合意している。矢継ぎ早にアフリカからの調達拡大に動くのは、欧州連合（EU）がロシア産ガスからの脱却にカジを切ったからだ。ロシアに頼るリスクを減らし、経済圧力を強める。EUの欧州委員会は3月、代わりにカタールや米国、エジプト、西アフリカからLNGの輸入を増やせるとし、アルジェリア産のパイプラインでの輸入にも期待を示した。「ロシア産の禁輸後、欧州市場にとってアフリカは強力な代替供給源になる」。ノルウェーのエネルギー調査会社ライスタッド・エナジーのシバ・プラサド氏はこう指摘し、既存のパイプラインやLNG供給で築いた関係が強みになるとみる。アフリカ大陸の天然ガス生産量が30年代後半までに4700億立方メートルと、22年見込みより8割増になるとの見方を示した。アフリカの資源国には自前の資金や技術が乏しい国が多く、欧州の急接近は開発の後押しになる。とはいえEUが21年に輸入した天然ガスの4割がロシア産だった。アフリカ諸国は計1割強、米国は約7%、カタールは約5%にとどまり、こうした国々から輸入拡大に動いても、直ちにロシア産の穴を埋めるのは難しい。またアフリカには欧州に近い地の利がある半面、政情や治安を巡る不安がつきまとう。北アフリカのリビアはイタリアにガスを送るパイプラインがあるが、長引く政情混乱で生産が安定しない。アフリカ南東部モザンビークの天然ガス開発事業は、イスラム過激派の攻撃で停滞を余儀なくされた。アルジェリアは隣国モロッコとの関係悪化で、同国経由のパイプラインでスペインに向かう天然ガス輸出を停止した。欧州へは他のパイプラインが稼働しているが、アフリカ域内の対立がエネルギー輸出に影を落としている。天然ガス開発には莫大な投資が必要なうえ、鉱区取得から生産までに10年以上かかる場合が多い。ロシアのウクライナ侵攻が終わり、陸続きのロシアからガスを輸入できる環境に戻れば、欧州にとってアフリカへの長期投資が色あせる可能性もある。
2022-06-19 18:15:27.149608,60955,"{1.909699559211731,2.377887010574341,2.663323163986206,2.0303497314453125}",その日、スタートアップ業界がざわめいた。昨年12月8日。SmartHR（スマートHR、東京・港）創業者で最...
2022-06-19 18:15:27.149608,60956,"{2.3323874473571777,1.875132441520691,2.3625905513763428,2.3059206008911133}",今回も東京工業大学の新入生向け講演から若者に参考にしてほしい話題を紹介します。仲間と議論するテーマには「私たちの未来」があるでしょう。大切にしたいのは歴史から学ぶ姿勢です。歴史には人類の成功も失敗も詰まっていて、未来を考えるヒントになると考えています。■教科書を読み直す世界史の教科書があれば1900年以降のページをめくってみるとよいでしょう。パンデミック（世界的大流行）や戦争を振り返ることが...
2022-06-19 18:15:27.149608,60957,"{2.7702324390411377,2.0715537071228027,2.6745972633361816,3.108896255493164}",今後の人口動態の変化や加速するデジタル化・グローバル化に即した医療制度と医療サービス提供体制の改革はどうあるべきか。日本経済新聞社と日本経済研究センターの医療改革研究会は、高い安全性・有効性を保ちつつ、より効率的な医療を実現するための提言を盛り込んだ最終報告をまとめた。デジタル技術を改革にフルに生かす「ヘルスケア・トランスフォーメーション」（HCX）をテコに、患者本位のサービス産業への転換を徹底...
2022-06-19 18:15:27.149608,60958,"{3.430083990097046,1.6371146440505981,2.996148109436035,3.6426544189453125}",食用コオロギ養殖のクリケットファーム（長野県岡谷市）が今夏、個人向けの商品を拡大する。塩やパウンドケーキに、たんぱく質が豊富なコオロギのパウダーを混ぜて売り出す。従来は食品メーカーへの販売が多かったが個人客向けの直売所も新設する。収益源の拡大だけでなく、昆虫食に対するイメージの刷新を目指す。同社は2021年8月に設立し、岡谷市の工場で食用コオロギを養殖している。ケース内で育ったコオロギは乾燥な...
2022-06-19 18:15:27.149608,60959,"{2.981708526611328,2.1505632400512695,3.0976710319519043,3.1907577514648438}",医療機器の実験施設を運営する「ふくしま医療機器開発支援センター」（福島県郡山市）は、医療関係者のトレーニング事業を拡大する。新型コロナウイルスの感染拡大で医療機関は院内での訓練が難しくなり、センターの施設活用に対する需要が高まっている。2022年度に医師と看護師を合わせた訓練件数は20年度の約3倍を見込む。新型コロナ禍を機に、医療機関には機能・役割の見直し、支援機関や企業との連携強化が求められ...
2022-06-19 18:15:27.149608,60960,"{3.5433619022369385,1.663110613822937,2.872518539428711,3.699174404144287}",首都圏の駅周辺などで歩行者の滞在しやすさを優先した街づくりが広がっている。飲食店のテラス席を歩道に広げたり、車道に芝生を敷き詰めたりすることで居心地のよい公共空間を目指す。迂回道も整備して車とのすみ分けを進め、中心部の消費地としての潜在力を引き出す狙いだ。東京都武蔵野市のJR三鷹駅北口エリアの歩道に4月、計20人ほど座れるテラス席が登場した。「歩行者中心のにぎわいエリア」にしようと武蔵野市が道...
2022-06-19 18:15:27.149608,60961,"{2.091871738433838,3.0675923824310303,3.0240039825439453,2.6072659492492676}",政府の新型コロナウイルスの水際対策について日本経済新聞社の世論調査で聞いた。1日あたり2万人の入国者数上限について「増やすべきだ」との回答は49%で、「増やすべきではない」の44%を上回った。世代別にみると18～39歳の55%が「増やすべきだ」を選び、上限引き上げに前向きだった。...
2022-06-19 18:15:27.149608,60962,"{2.5269999504089355,2.349003314971924,2.584890365600586,2.605614185333252}",日本経済新聞社の世論調査で参院選で望む結果について聞いた。自民党と公明党の与党が過半数を「維持する方がよい」と回答した割合は58%、憲法改正に賛成する勢力が3分の2以上の議席を「維持する方がよい」は53%だった。世代別に分析すると年齢が若いほど与党過半数を「維持する方がよい」の割合が大きかった。18～39歳以下は66%、40～50歳代は58%、60歳以上は57%だった。改憲勢力が3分の2を維持...
2022-06-19 18:15:27.149608,60963,"{2.4587039947509766,2.2667086124420166,2.4947638511657715,2.701953649520874}",日本経済新聞社が17～19日に実施した世論調査で、7月10日投開票の参院選で重視する政策について12項目のなかから複数回答で聞いた。トップは景気回復の44%で、年金・医療・介護が35%、外交・安全保障が28%と続いた。新型コロナウイルス対策は16%で7番目だった。参院選は22日の公示を受けて選挙戦が正式に始まる。与野党は街頭演説や公約で訴える政策を通じて支持基盤固めや他党支持層への浸透を狙う。...
2022-06-19 18:15:27.149608,60964,"{2.1963939666748047,2.4957516193389893,2.8374781608581543,2.481588125228882}",米国で高インフレが続いている。米連邦準備理事会（FRB）の急速な金融引き締め路線が株安を招き、消費者心理も冷え込む。クレジットカード大手マスターカードの経済研究所の米国チーフエコノミスト、ミシェル・メイヤー氏に米経済の約7割を占める個人消費の先行きを聞いた。――米国の個人消費の現状をどうみていますか。「オンラインより店舗での消費が伸びている。我々のデータで4月の店舗の売上高は前年同月比10%...
2022-06-19 18:15:27.149608,60965,"{2.1640465259552,2.0665183067321777,2.6162898540496826,2.44903826713562}",【ボゴタ=宮本英威】南米コロンビアで19日、大統領選の決選投票が始まった。事前の世論調査では左派のグスタボ・ペトロ元ボゴタ市長（62）と実業家で独立系のロドルフォ・エルナンデス氏（77）が大接戦を繰り広げている。即日開票で同日夜（日本時間20日午前）には大勢が判明する見通しだが、僅差の争いになる可能性が高そうだ。ペトロ氏は元左翼ゲリラで、上院議員などを長年務めてきた経験豊富な政治家だ。貧富の格...
2022-06-20 18:15:36.677973,61228,"{2.9907326698303223,2.1904666423797607,2.899088144302368,3.1894967555999756}",電炉大手の東京製鉄は20日、鋼材全品種の7月分契約価格を6月分から据え置くと発表した。製造業で幅広く使う熱延鋼板は1トン12万7千円、ビルの柱や梁（はり）に使うH形鋼は同12万4千円を維持する。全品種の据え置きは2カ月連続。これまでの値上げ分について流通市場への浸透度合いを見極めたいとしている。同社は電炉の主原料である鉄スクラップの仕入れ価格の高騰やアジア鋼材相場の上昇を背景に、3月分から建設...
2022-06-20 18:15:36.677973,61229,"{1.7434382438659668,3.410806179046631,3.347827911376953,2.1076138019561768}",【ロンドン=共同】英国防省は20日、ロシア空軍が完全な制空権を確保できず、リスク回避の作戦を展開しているとの戦況分析を発表した。その結果、ウクライナ軍の防衛線の背後に深く入り込むことはほとんどないとしている。ロシア空軍は高性能な戦闘機を多く保有している一方で、西欧型の近代的作戦を展開するのに必要な組織文化や技能の開発に失敗してきたと指摘。空軍が機能せず、地上部隊が計画以上の負担を強いられて疲弊しているとの見方を示した。
2022-06-20 18:15:36.677973,61230,"{2.1352016925811768,2.7266318798065186,2.829411745071411,2.2896969318389893}",日本証券業協会が20日発表した5月の国債投資家別売買高によると、生損保は30年物国債など超長期債を2625億円買い越した。前月比38%減で、買越額は2019年8月以来2年9カ月ぶり低水準。海外で金融引き締めの動きが続くなか、日銀が無制限に国債を買い入れる指し値オペ（公開市場操作）の対象外である超長期債の利回り上昇が進むとの見方から、買いの動きが鈍った。生保は米利上げに伴うヘッジコストの上昇を背...
2022-06-20 18:15:36.677973,61231,"{1.6915318965911865,3.0471646785736084,3.2244062423706055,1.808919072151184}",大豆などの原材料高騰が、主要食品企業の2023年3月期業績を直撃する。東洋水産や森永乳業など主要20社で、期初予想時点で減益要因として開示した19社の合計額は2700億円と前期営業利益合計額の約44%に相当することがわかった。各社は値上げで対応する計画だが、消費者の節約志向が続く中でどこまで転嫁できるかは不透明だ。足元では為替の円安・ドル高も進んでおり、一段と影響が拡大する可能性もある。3月期...
2022-06-20 18:15:36.677973,61232,"{2.20975923538208,2.7773635387420654,2.8533616065979004,2.4370574951171875}",前週の各国中央銀行の金融引き締め加速を受け、東京株式市場で世界景気の減速懸念の織り込みが進む。日経平均株価の構成銘柄のうち海外売上高比率の高い企業で構成する「日経平均外需株50指数」は20日、1カ月ぶりの安値をつけた。一方で世界景気の影響を受けにくい内需株の下げ幅は小さく、投資家の保守姿勢が強まっている。20日、外需株指数は29515.57と中銀ウイークに入る前の10日比で8%下げ、下落率は日...
