datetime,results,news_text,text
2022-06-23 18:15:36.904775,62505,"{3.116586685180664,1.9067455530166626,3.0595502853393555,3.8053691387176514}",自動車の骨格部品を手掛けるジーテクトは今後10年間で電気自動車（EV）に関連する設備投資や研究開発に700億円を投じる計画だ。モーターの鉄心部分の中核部品や、車載電池を収納するケースなどを開発する。欧州を中心に自動車大手のEVシフトが鮮明になるなか、成長分野に投資を振り向ける。EV関連で売上高1000億円、営業利益率で8%を目指す。「自動車産業におけるEV化は成長の機会ととらえている」。ジーテ...
2022-06-23 18:15:36.904775,62506,"{1.992126703262329,2.726142168045044,3.0721795558929443,2.550222873687744}",ロシアのウクライナ侵攻による資源価格の高騰が建設資材価格を押し上げている。為替相場の円安傾向も重なり、鋼材や塩化ビニール樹脂などは国内価格で最高値が相次ぐ。国内メーカーで値上げ要請が広がっている一方、内需は鈍い。7～9月期に価格転嫁がどこまで進むかは不透明感が残る。資材価格の上昇が一服するとの見方もでている。「ここまで急激な値上げは過去に経験がない。メーカーの値上げ分は受け入れざるを得ず、すぐ...
2022-06-23 18:15:36.904775,62507,"{2.2264509201049805,2.3398470878601074,2.9541573524475098,2.672123670578003}",経済産業・国土交通両省は洋上風力発電の公募で落札制限を設け、多様な企業の参入を促す方針だ。サプライチェーン（供給網）を多様化させ、独占の弊害を早めに抑え込む。ただ、従来方針を転換すれば、電気の販売価格を安くしても選定されないといった事態が想定される。競争環境をゆがめる恐れはある。秋田県八峰町・能代市沖で第2弾となる公募を始めていた2021年12月、三菱商事の子会社を中心とする企業連合が第1弾の...
2022-06-23 18:15:36.904775,62508,"{2.582326650619507,2.6662650108337402,2.9390339851379395,2.845212936401367}",国民生活を揺さぶる物価高が参院選で論戦の争点になっている。4月の消費者物価指数（CPI）は前年同月比2.5%上がり、消費増税の影響があった時期を除くと1991年12月以来30年ぶりの伸びになった。インフレへの警戒感は高齢層で際立ち、参院選では各党が対策を競う。CPIは変動の大きい生鮮食品を除く総合指数でも前年同月比2.1%上昇し、消費増税の影響があった2015年3月（2.2%）以来、7年1カ月...
2022-06-23 18:15:36.904775,62509,"{2.2963452339172363,2.386209726333618,2.8965165615081787,2.434329032897949}",日本の医療が少子高齢化を乗り越えるには負担と給付の発想を転換する必要がある。だが改革の動きはあまりに鈍い。「マイナンバーを活用すること等により、金融資産等の保有状況を考慮に入れた負担を求める仕組みを検討する」。政府が経済財政運営と改革の基本方針（骨太の方針）に記した文言だ。といっても今年の骨太方針ではない。安倍晋三政権が2015年に閣議決定したものだ。「団塊の世代」の全員が75歳以上になる2...
2022-06-23 18:15:36.904775,62510,"{2.792147397994995,1.99528968334198,3.019172191619873,3.0022618770599365}",1982年の東北新幹線、大宮―盛岡間の開業から40年。栃木県内には小山、宇都宮、那須塩原と3駅が設置され、移動時間の大幅な短縮でビジネスや観光など移動は活発になった反面、首都圏への流出も引き起こした。栃木の自治体は新型コロナウイルス禍で3密回避の「新幹線通勤」をアピールし移住や定住者獲得に知恵を絞っている。那須塩原駅。平日午前6時台は同駅始発も含め、5本の東京行き各駅停車タイプのなすの号が設定...
2022-06-23 18:15:36.904775,62511,"{1.8700902462005615,2.7455408573150635,2.7436916828155518,1.8269487619400024}",【NQNロンドン=菊池亜矢】23日のロンドン株式市場で、FTSE100種総合株価指数は続落した。前日に比べ68.77ポイント（0.97%）安の7020.45で引けた。景気減速に伴う需要減の懸念から、原油や金属相場が下落しており、エネルギー株や資源株に売りが出た。
2022-06-23 18:15:36.904775,62512,"{1.6917768716812134,4.053513050079346,3.53336763381958,1.8434175252914429}",【カイロ=久門武史】イスラエルのラピド外相は23日、敵対するイランがトルコでイスラエル人を狙う「テロ攻撃の企て」をトルコ当局の協力で阻止したと述べた。訪問先のトルコでチャブシオール外相と会談し、謝意を示した。イランで相次いだ軍人らの不審死にイスラエルの関与が取り沙汰され、イランが報復を警告していた。ラピド氏は外相会談後の記者会見で「ここ数週間、トルコとの協力によりイスラエル市民の生命が守られた」と強調した。「イランがテロ攻撃の企ての背後にいる」と断じ「トルコの主権の明白な侵害でもある」と批判した。トルコメディアは同日、情報機関と警察が最大都市イスタンブールでイスラエルの外交官や観光客の誘拐・殺害を計画していたイラン人らを17日に逮捕したと報じた。これに先立ち、イスラエル政府はイスタンブールに滞在する自国市民に即時帰国を呼び掛けていた。イランでは5月下旬、テヘランで革命防衛隊の大佐が射殺され、ライシ大統領が「必ず報復する」と述べていた。直後にテヘラン郊外の軍事施設へのドローン攻撃で技術者が死亡したと伝えられ、6月にも科学者の毒殺疑惑が報じられた。いずれもイスラエルの関与が取り沙汰された。一方、イランのメディアは23日、革命防衛隊の情報部門トップがホセイン・タエブ氏からモハンマド・カゼブ氏に交代したと報じた。理由は不明だ。イスラエルとトルコの関係は2010年にイスラエル軍がパレスチナ自治区ガザに向かっていたトルコの支援船を襲撃した事件で悪化していたが、改善の動きが加速している。イスラエルは今月20日に連立政権が国会の解散で合意したばかりで、ラピド氏は総選挙を経て新政権ができるまで暫定的に首相を務める見通しだ。
2022-06-23 18:15:36.904775,62513,"{2.481170177459717,2.0316638946533203,2.7582552433013916,2.899198055267334}","米男子ゴルフツアーは22日、来季から8大会で賞金を増額することや新規大会を創設することなどを発表した。サウジアラビア政府系ファンドが支援する超高額賞金の新ツアー「LIV招待」への対抗策。""第5のメジャー""と呼ばれるプレーヤーズ選手権は今年の賞金総額2千万ドルから2500万ドル（約34億円）に増やす。「LIV招待」と同様に予選落ちなしで、選手数を絞った国際的な3大会を秋に創設する。また、秋に開幕して年をまたぐ日程を再編し、2024年からは1月開幕で8月までレギュラーシーズンを実施し、同一年に収まる形にする。現在125人が進むプレーオフを来季から70人に減らすことも発表された。モナハン・コミッショナーは、サウジの後ろ盾で大金にものをいわせて選手をかき集めている新ツアーの姿勢を批判し「私たちは健全な競争は歓迎する。でもLIVサウジ・リーグはそうではない」と危機感をあらわにした。〔共同〕"
2022-06-23 18:15:36.904775,62514,"{1.9734008312225342,2.878755569458008,2.4720852375030518,2.0342535972595215}",【NQNロンドン=菊池亜矢】23日のロンドン外国為替市場でユーロは対ドルで下落し、英国時間16時時点は1ユーロ=1.0520～30ドルと、前日の同時点に比べ0.0070ドルのユーロ安・ドル高で推移している。23日発表の6月のユーロ圏購買担当者景気指数（PMI、速報値）が前月から急低下した。天然ガスの供給不足への警戒感も強く、欧州経済の減速を懸念したユーロ売り・ドル買いが優勢となっている。ドイツ政府が23日、天然ガス不足で「非常警報」を発令した。消費量を減らすよう呼びかける。ロシア国営のガスプロムがドイツへの天然ガス供給を大幅に削減する方針を決め、供給不足が懸念されていた。天然ガス先物価格が大幅に上昇しており、ドイツ経済が減速するリスクが高まったとの見方もユーロ売り・ドル買いを促した。円は対ユーロで大幅に上昇し、英国時間16時時点は1ユーロ=141円60～70銭と前日の同時点に比べ2円30銭の円高・ユーロ安で推移している。欧州の景気減速懸念から対円でもユーロ売りが優勢となっている。英ポンドは対ドルで下落し、英国時間16時時点は1ポンド=1.2270～80ドルと前日の同時点に比べ0.0030ドルのポンド安・ドル高で推移している。
2022-06-23 18:15:36.904775,62515,"{1.8655039072036743,3.3494911193847656,2.9186675548553467,1.9958609342575073}",【NQNロンドン=菊池亜矢】23日の欧州国債市場で、指標銘柄であるドイツ連邦債10年物の利回りは英国時間16時時点で、前日の同時点と比べ0.202%低い（価格は高い）1.423%で取引されている。ドイツ政府が23日、天然ガス不足で「非常警報」を発令した。ロシアからの供給減少で、長期的にガスが不足する可能性が高まっている。ドイツ経済の減速リスクが高まったとの見方から、相対的に安全資産とされるドイツ国債が買われた。6月のユーロ圏購買担当者景気指数（PMI、速報値）が前月から大幅に低下したのも、ドイツ国債の買いにつながった。英国の10年債利回りも低下し、英国時間16時時点は、前日の同時点より0.171%低い2.289%で推移している。
2022-06-23 18:15:36.904775,62516,"{1.880528211593628,2.95296573638916,3.2681453227996826,1.9029686450958252}",【ニューヨーク=河内真帆】米ナイキがロシア事業から完全に撤退することが23日分かった。ロイター通信など複数のメディアが報じた。3月初旬にはロシア国内で通信販売を停止し、店舗も一時閉鎖していた。ロシアとウクライナをあわせた売上高は同社全体の1%未満で、撤退による直接的な影響は限られる。同社はロシアによるウクライナ侵攻に強く抗議しており、完全撤退で反対の姿勢をより明確にする。メディア各社への声明では「ロシア市場から離れる決定をした。我々の優先課題は、今後責任を持ちながら業務を縮小する間に従業員を支援することだ」と表明した。ナイキのサイトによると、ロシアでは直営とフランチャイズ店を含めて50店舗超を展開している。ナイキは3月にロシアでの通販を停止し、その後は店舗を一時閉鎖した。現地メディアによると、5月下旬にはフランチャイズ店に対して契約を延長しないと通達していた。
2022-06-23 18:15:36.904775,62517,"{3.3509907722473145,1.4880287647247314,2.520348310470581,3.1858930587768555}",北海道室蘭市南部の無人駅で販売している「幻の駅弁」がある。名前は駅名にちなみ「母恋（ぼこい）めし」で発売から20年目を迎えた。中身はホッキ貝を炊き込んだおにぎりや薫製チーズ、玉子など盛りだくさん。お母さんが恋しくなる味で全国に根強いファンがいる。JR室蘭本線の東室蘭駅から電車で10分ほどで母恋駅に着く。近隣には日本製鋼所室蘭製作所がそびえたつ。駅に唯一隣接しているのが「母恋めし」の売店。弁当は...
2022-06-23 18:15:36.904775,62518,"{2.0156311988830566,3.5296239852905273,3.382687568664551,2.2685546875}",【ワシントン=芦塚智子】米連邦最高裁は23日、東部ニューヨーク州の銃規制法は違憲との判断を下した。合衆国憲法修正第2条が保障する自衛のための武器保有の権利を侵害するとした。銃規制の緩和につながる判決で、相次ぐ乱射事件で多数の犠牲者が出た直後だけに規制強化派の反発が予想される。ニューヨーク州の銃規制法は、短銃を隠して携帯する際に免許の取得を義務付け、さらに「正当な理由」を提示するよう定めている。...
2022-06-24 18:15:43.315127,62577,"{1.3913681507110596,4.019720554351807,3.7249863147735596,1.747397780418396}",京都府と京都市は２４日、新型コロナウイルスに感染した２人が死亡し、１０歳未満から９０歳以上の３０４人が新たに感染したと発表した。府内の死者…
2022-06-24 18:15:43.315127,62578,"{2.245204448699951,2.376241683959961,2.467120409011841,2.5552802085876465}",参院選京都選挙区の個人演説会で支援を呼びかける泉代表（２４日、京都市伏見区）立憲民主党の泉健太代表は２４日、参院選（７月１０日投開票）公示後初めて京都府内に入った。京都選挙区（改選数２）に立候補している現職が京都市伏見区で開いた個人演説会で「我々は政権を目指す政党。物価高に対して生活者目線でみなさんを助けたい」と呼びかけた。泉氏は岸田政権の物価高騰への対応について「アメリカより値上がりが『大したことない』と言う。生活感覚がない」と批判。「我々は経済、産業、安全保障政策でみなさんに安心してもらう」と訴えた。京都選挙区が自民党、日本維新の会の候補と争う情勢となっていることを意識し「自民と論戦できる野党は立憲民主党だ」と声を上げ、自身の衆院議員としての地盤で支持拡大に力を込めた。
2022-06-24 18:15:43.315127,62579,"{1.4350438117980957,4.000816822052002,3.749375581741333,1.7004164457321167}",京都府与謝野町京都府与謝野町で昨年１２月、乗用車が民家の外壁に衝突し４人が死傷した事故で、京都家裁は２４日までに、自動車運転処罰法違反（危険運転致死傷）の疑いで家裁送致された舞鶴市の自衛官の男（１９）を検察官送致（逆送）することを決めた。決定は２１日付。家裁の決定によると、男は、昨年１２月７日午前２時ごろ、同町石川の国道１７６号を時速約１００キロで走行し、雨で路面がぬれていた道路のカーブを曲がりきれずに民家の外壁に衝突。同乗者＝当時（１９）＝を死亡させ、他の同乗者３人にも重軽傷を負わせたとしている。田中幸大裁判官は決定理由で、男が自分の運転技術を誇示したいなどという目的から速度を上げた末に４人を死傷させたとして、「動機にくむべき点があるとは到底言えない」と指摘。「生じた結果は痛ましく重大である」として刑事処分が相当だとした。男は昨年１２月に宮津署に自動車運転処罰法違反（過失致死傷）の疑いで逮捕され、３月に京都地検舞鶴支部が危険運転致死傷の疑いに切り替えて家裁送致していた。
2022-06-24 18:15:43.315127,62580,"{1.6978133916854858,3.1564955711364746,3.4012303352355957,1.9184294939041138}",京都府宇治市役所京都地裁京都府宇治市斎場（同市宇治）で２０２０年１１月、火葬後の遺骨を遺族が拾う前に職員が誤って集じん機で吸引したとして、同市に３３００万円の損害賠償を求めて２１年３月に京都地裁に提訴した原告の遺族が、訴訟を取り下げたことが２４日までに分かった。宇治市が、市議会６月定例会の産業・人権環境常任委員会で明らかにした。取り下げは１７日付。原告の代理人弁護士は「理由は差し控えたい」としている。同斎場は民間業者が指定管理業務を担っており、市は「事案があったことは事実として認めるが、責任はない」として、請求棄却を求めていた。
2022-06-24 18:15:43.315127,62581,"{1.8216402530670166,2.9231278896331787,3.5103540420532227,1.9140533208847046}",京都大学京都大は２４日、理学研究科の元特定研究員が著者である植物に関する５本の論文で、画像データの捏造（ねつぞう）や改ざんの不正があったと発表した。京大は論文の撤回を勧告し、処分を検討している。不正認定されたのは、リアンウエイ・パン元研究員（４３）。論文は、シロイヌナズナの葉緑体に存在するタンパク質などを解析した内容で、２００８～１２年に国際科学誌に発表された。実験データを示す計１１点の図で、コントラストや位置を加工したり、別の画像を挿入したりしていた。京大によると、いずれの不正も元研究員が単独で行っており、論文全体の結論に影響はなかった。元研究員は「図の見栄えをよくするためだった」などと説明している。確認を怠ったとして責任著者の鹿内利治教授（６２）についても処分を検討するという。
2022-06-24 18:15:43.315127,62582,"{2.426140785217285,2.101567029953003,2.300276756286621,2.6445906162261963}",参院選で応援演説する松井代表（24日、京都府京田辺市・ＪＲ松井山手駅前）日本維新の会の松井一郎代表は２４日、参院選（７月１０日投開票）公示後初めて京都府内に入り、京田辺市内で演説に臨んだ。維新が掲げる「身を切る改革」をアピールし、「改革には自信がある。全国に広げていくために力を結集してほしい」と力を込めた。同市のＪＲ松井山手駅前で京都選挙区（改選数２）の新人候補と並んだ松井代表は、岸田政権や自民党の支持率が安定している現状に「ゆるみ、たるみ、おごりがある。皆さんと同じ目線で税金の使い方を決めているのか」と指摘。「自民党をぴりっとさせるわれわれに（議席を）与えてもらえれば、国においても税金の使い方を見直させる。大阪でやっている改革を永田町、霞が関から全国に広げる」と訴えた。
2022-06-24 18:15:43.315127,62583,"{1.4018747806549072,4.1164326667785645,3.7686731815338135,1.7070274353027344}",京都地検京都地検は２４日、強盗致傷と住居侵入の疑いで逮捕された大津市の職業不詳の男性（４５）を不起訴処分（嫌疑不十分）にした。男性は昨年１１月２８日午前７時１５分ごろ、京都市右京区の女性（７８）宅に侵入し、「金、出せ」と女性を押し倒して肋骨（ろっこつ）を折る重傷を負わせ、現金約５万円や指輪などを奪ったとして、先月１２日に京都府警に逮捕された。
2022-06-24 18:15:43.315127,62584,"{1.385144829750061,4.180637836456299,3.773704767227173,1.6726027727127075}",京都地検京都府亀岡市で４月、パトカーに追跡された乗用車が宝石・時計店に衝突し炎上した事故で、京都地検は２４日、乗用車を運転していた男子専門学校生（１８）＝亀岡市＝を、自動車運転処罰法違反（危険運転致傷）の疑いで京都家裁に送致した。男子専門学校生は、４月１７日午前２時すぎ、同市内で、制限速度４０キロを大幅に上回る速度で乗用車を運転し、宝石・時計店に衝突、助手席のアルバイト男性＝当時（１９）＝に重傷を負わせたとして、今月２２日に府警に書類送検された。
2022-06-24 18:15:43.315127,62585,"{3.2326178550720215,1.6339011192321777,2.703639030456543,3.5854268074035645}",日本マクドナルド（東京）は２４日、関西１号店が京都市内にオープンしてから今年で５０周年の節目を迎えるのに合わせ、７月１日から京都府内のマク…
2022-06-24 18:15:43.315127,62586,"{3.138172149658203,1.770477294921875,2.2681782245635986,3.6063294410705566}",西日本最大級の古美術・工芸品の展示即売会「京都アンティークフェア」が２４日、京都市伏見区の京都パルスプラザ展示場で始まり、多くの来場者でに…
2022-06-24 18:15:43.315127,62587,"{3.1664347648620605,1.6590687036514282,2.3754661083221436,2.8313307762145996}",昨年に設立４０周年を迎えた京都市芸術文化協会（芸文協、京都市中京区）が、月１回の「藝（げい）文京茶論（さろん）」を始めた。芸術家だけでなく…
2022-06-24 18:15:43.315127,62588,"{3.444298267364502,1.5563913583755493,2.4530413150787354,3.408514976501465}",嵐電沿線の商店街をテーマにした京都市の無料冊子が、じわじわと人気を集めている。商店街の店舗で割引やユニークなサービスを受けられるクーポンや…
2022-06-24 18:15:43.315127,62589,"{1.59559965133667,2.480079174041748,3.2879672050476074,2.0707767009735107}",国民的スターだった歌手の美空ひばりが１９８９（平成元）年に５２歳で亡くなってから、６月２４日で３３年になる。「京都太秦　美空ひばり座」とい…
2022-06-24 18:15:43.315127,62590,"{3.2567262649536133,1.6018153429031372,2.529421806335449,3.249819278717041}",京都の和菓子屋を舞台にしたアニメ「であいもん」にちなみ、関連する図書を並べた展示コーナーが京都市左京区の市左京図書館に設けられている。　で…
2022-06-24 18:15:43.315127,62591,"{2.8466246128082275,1.828628659248352,2.1916041374206543,2.7370707988739014}",京都五花街合同公演「都の賑（にぎわ）い」の開幕を控えた２４日、会場となる南座（京都市東山区）でリハーサル「総ざらえ」があった。出演する芸舞…
2022-06-24 18:15:43.315127,62592,"{2.217951536178589,2.341062545776367,2.4163010120391846,2.6857306957244873}",成長と分配を好循環させて、持続可能な経済の実現を目指すのが「新しい資本主義」とされる。単に成長を促すだけでなく、その果実を分配して国民の間の格差を是正していくのだから、方向性としては望ましい。それなのに、公示された参院選の論戦で、あまり取り上げられていないのは残念である。「新しい資本主義」は、昨年秋の自民党総裁選で、岸田文雄首相が看板政策として打ち出した。岸田氏以前の安倍晋三・菅義偉両政権における経済政策の基本はいわゆる「アベノミクス」であった。大胆な金融緩和、機動的な財政出動、成長戦略の「三本の矢」をもって、日本経済を再生しようとした。円高を是正して株価を上げて、大手企業を中心に業績を回復させた。しかしその恩恵が、広く国民に及んだとは言い難い。そこで岸田氏が、経済政策の力点を、格差是正や分配に移したのは、当然の流れであろう。ところが当初、分配の「原資」に充てようとした株式売却益など金融所得への課税強化は、市場の反発もあって、早々に封印してしまった。参院選公示前、事実上の与党公約となる「新しい資本主義」実行計画を決めたものの、分配に関する政策は、最低賃金の早期引き上げや、少額投資の非課税制度拡充にとどまった。池田勇人元首相の「国民所得倍増計画」に倣い、「令和版所得倍増」を唱えていたのに、家計に貯蓄から投資への移行を促す「資産所得倍増プラン」に置き換えてしまった。これでは、掛け声倒れといわれても仕方ないだろう。選挙戦で野党は、主に物価高対策を巡って、与党への批判を強めている。大事なことではあるが、その一方で、今後の経済政策について、中長期的な展望を示していく必要がありそうだ。日本の平均賃金は、約３０年前からほぼ横ばいの状態で推移している。この状況を脱するには、欧米などと比べて安すぎるとされるモノやサービスの値段を、見直すべきだとの主張がある。企業の内部留保に当たる利益剰余金は、約５００兆円にも上っている。これを活用することはできないものか。新しい資本主義、特に分配に関して与野党は、財源も考慮した具体策を掲げて議論を深めてもらいたい。
