datetime,results,news_text,text
2022-06-13 18:15:32.126224,59152,"{2.275026559829712,1.9448786973953247,2.2071635723114014,2.520034074783325}",日銀は20日付で、松江支店長に長谷川圭輔・政策委員会室総務課長（48）を充てる人事を発表した。谷本英行支店長（54）は検査室検査役に異動する。...
2022-06-13 18:15:32.126224,59153,"{2.9268693923950195,1.8256351947784424,2.8706018924713135,3.2981159687042236}",住宅設備機器の延長保証事業を手がける。主力商品は給湯器やキッチン、家電製品などを修理するサービス「あんしん修理サポート」だ。ハウスメーカーや家電量販店が主要顧客で、業務受託料を徴収し、メーカーの保証期間を含めて最長10年間サポートする。中古住宅設備の保証も取り扱っているほか、鍵の紛失や水回りトラブルといった生活全般をサポートする事業も展開している。2022年9月期の単独売上高は前期比...
2022-06-13 18:15:32.126224,59154,"{3.443498134613037,1.6892368793487549,2.997925281524658,3.5503740310668945}",パーティー向けクラッカーなどを製造販売するカネコ（愛媛県宇和島市）が、煙の出にくいクラッカーでスポーツ市場の開拓に挑んでいる。福岡ソフトバンクホークスがホームゲームでの応援グッズとして採用し、バスケットボールの試合でも使われ始めた。新型コロナウイルス禍における声援に代わる新たな応援手法として売り込む。新商品「応援クラッカー」（500円）は、福岡ソフトバンクホークスの本拠地「福岡ペイペイドーム」...
2022-06-13 18:15:32.126224,59155,"{1.485708475112915,3.5791420936584473,3.509981870651245,1.7144328355789185}",国の新型コロナウイルス対策の持続化給付金を詐取したとして東京国税局の職員らが逮捕された事件で、警視庁少年事件課は13日、グループのリーダー格とみられ、アラブ首長国連邦（UAE）のドバイに出国していた住所・職業不詳、松江大樹容疑者（31）を詐欺容疑で逮捕した。同課によると、13日夕に成田空港に帰国した。「弁護士が来てから話します」と認否を留保しているという。松江容疑者らのグループは虚偽申請の名義人としてSNS（交流サイト）を通じて大学生らを募り、200人分に当たる計約2億円の不正受給に関与したとみられる。松江容疑者は今年2月ごろ、ドバイに出国し、警視庁が行方を追っていた。逮捕容疑は2020年8月、当時17歳の高校生=同容疑で書類送検=を新型コロナの影響で事業収入が減った個人事業主と偽り、持続化給付金100万円をだまし取った疑い。捜査関係者によると、不正に受給した給付金のうち8割は松江容疑者にわたり、暗号資産への
2022-06-13 18:15:32.126224,59156,"{2.5573606491088867,1.7536009550094604,2.588338613510132,2.660762310028076}",J2の東京Vは13日、堀孝史監督（54）が退任し、昨季途中までJ1広島を指揮した城福浩氏（61）が就任すると発表した。東京Vは21試合を終えて6勝8分け7敗の14位。最近7試合は未勝利だった。城福氏はJ1のFC東京をヤマザキナビスコ・カップ（現YBCルヴァン・カップ）優勝に導いたほか、甲府でJ2優勝の実績がある。東京Vを通じ「ヴェルディのサッカーをより進化させていくミッションに携わることができて光栄」とコメントした。〔共同〕
2022-06-13 18:15:32.126224,59157,"{1.850146770477295,2.501124620437622,2.830836534500122,2.0702245235443115}",東建コーポレーションは13日、2023年4月期の連結純利益を前期比20%減の82億円と見込んでいると発表した。建設事業や不動産賃貸を伸ばすが、建築資材の値上がりや営業担当者を増やすなど経費が増え最終減益となる見通し。売上高は6%増の3286億円、営業利益は19%減の122億円を見込む。建設では前期に受注が増えたため売上高が伸びるものの、ウクライナ危機などを背景に資材が値上がりしており完成工事利益率が下がる。不動産賃貸も管理物件数を増やす一方、経費が膨らみ事業利益は微減を見込む。同日発表した22年4月期の連結決算は、売上高が前の期比1%増の3115億円、純利益が2%増の102億円だった。世界の木材不足で価格が高騰する「ウッドショック」の影響などで建設事業の営業利益は25%減の84億円（全社費用除く）にとどまり、不動産賃貸では管理物件が増えて営業利益が20%増の138億円（同）と好調だった。
2022-06-13 18:15:32.126224,59158,"{2.168595790863037,2.7228407859802246,2.99886155128479,2.472273588180542}",13日の国内債券市場で長期金利の指標となる新発10年物国債利回りが一時0.255%と、日銀が上限として示す「0.25%程度」を上回った。日銀は0.25%の利回りで無制限に国債を購入しているのに、0.25%より高い金利（価格は低い）で取引が成立したことは、人為的に金利を抑え込む「ひずみ」の表れとみられている。上限超えの背景には「日銀がディーラーなどに国債を貸し出す国債補完供給（SLF）の利用制限...
2022-06-13 18:15:32.126224,59159,"{2.460728645324707,1.956971526145935,2.427222728729248,2.7919247150421143}",日銀は13日、鈴木俊一財務相が12日付でボストン・コンサルティング・グループ（BCG）日本共同代表の秋池玲子氏を同行の参与に任命したと発表した。
2022-06-13 18:15:32.126224,59160,"{2.238586902618408,2.1947431564331055,2.4297754764556885,2.4787709712982178}",サッカーの日本代表は14日午後6時55分から、トーナメント方式のキリンカップでチュニジアとの決勝に臨む。約2週間に及ぶ4連戦の締めくくり。ワールドカップ（W杯）カタール大会にも出場するチームに日本の力が試される。13日は両チームがオンラインでの公式記者会見を行った。日本代表の森保一監督は「人（の組み合わせ）という意味でチームのオプションを増やせるように。ガーナ戦からは（先発を）大幅に変えるが、また色々な融合がみられるのでは」と語った。右足を痛めたDF中山（ズウォレ）の起用は見合わせ、全体練習に合流して間もないDF冨安（アーセナル）についても「いきなり国際試合のプレー強度のなかでできるか、リスクがある」と慎重な考えを示した。国際サッカー連盟（FIFA）ランキング1位のブラジルとの戦いで得た肌感覚と教訓を「形にしていかないと」と吉田（サンプドリア）はいう。ベテラン川島（ストラスブール）は「差がつくのは小さいところ、勝敗を変えていくのは細かいところ」と話す。ここまでの3試合、失点は自陣でのイージーなミスから。ミスそのものより、ミスの前や後の一つ一つの状況における準備、判断、対応の細かな差が、勝敗を分かつ大きな差になると川島は戒める。「ミスのないゲームはない。1つ起きた後に、2つ目を起こさない、うまく（危険を）絶つなど、次にどう対応するか」チュニジアに派手さはないが、個々人の身体能力は高く、モダンな組織力も備える。日本の小さな緩みを突くのには実力十分。W杯本大会で基準とすべき細やかさを、守備でも攻撃でも表現しながら勝ちきりたい。
2022-06-13 18:15:32.126224,59161,"{1.8763624429702759,2.902503490447998,3.1587395668029785,1.9761301279067993}",13日の外国為替市場で円相場が一時、1ドル=135円台前半まで下落した。金融不安で「日本売り」に見舞われていた1998年以来、約24年ぶりの円安・ドル高水準に逆戻りした。円安を招く構図は当時と様変わりした。浮かび上がるのは産業競争力を底上げしてこなかった日本経済のもろさだ。円相場は対ドルで一時1ドル=135円22銭近辺まで下落した。今年の円の下落率は1割強に達し、世界の主要通貨で最も価値を下げ...
2022-06-13 18:15:32.126224,59162,"{2.4507226943969727,2.1075758934020996,2.9553818702697754,2.5772223472595215}",関東の酪農家らでつくる関東生乳販売農業協同組合連合会（東京・文京）は13日、乳業メーカーに販売する生乳の価格（飲用乳価）について、1キロ当たり15円の引き上げを求めて交渉に入る方...
2022-06-13 18:15:32.126224,59163,"{1.8494596481323242,2.7980127334594727,3.0607926845550537,1.8993159532546997}",石油化学製品の基礎原料となるナフサ（粗製ガソリン）のスポット（随時契約）価格が一段と下落した。13日のアジア市場では1トンあたり799ドルを中心に取引され、前週末から6ドル程度（0.7%）下がった。800ドルを下回ったのは1月末以来、およそ4カ月半ぶりとなる。中国では新型コロナウイルスの感染拡大を抑えるロックダウン（都市封鎖）の影響が残り、石化製品の需要が低迷する。一方、ガソリンなどは高値で推...
2022-06-13 18:15:32.126224,59164,"{2.0944998264312744,3.0212044715881348,2.9263734817504883,2.1096789836883545}",【NQNロンドン=菊池亜矢】13日午前の欧州株式市場で主要株価指数は全面安となっている。ドイツ株価指数（DAX）やフランスCAC40の下げ幅は2%を上回った。高進するインフレに対し欧米の中央銀行が積極的な金融引き締めを実施し、世界的に景気が後退す
2022-06-13 18:15:32.126224,59165,"{2.25995135307312,2.1027779579162598,3.094470977783203,3.3927605152130127}",ビルの柱に使う大径角形鋼管（コラム）の取引価格が一段と上昇した。東京地区の問屋仲間価格は現在1トン17万9千円前後。5月に比べ5千円（3%）ほど高く、過去最高値を更新した。原材料の値上がりを受けて建材メーカーが製品価格を引き上げており、流通市場で転嫁が進んでいる。2020年12月につけた直近安値（同10万3千円前後）からの上昇幅は7万6千円（74%）に達する。ロシアのウクライナ侵攻後、...
2022-06-13 18:15:32.126224,59166,"{2.6448895931243896,2.201594352722168,2.8458118438720703,3.1015830039978027}",大阪取引所に上場する円建ての金先物価格がおよそ2カ月ぶりの高値をつけた。13日には一時1グラム8106円と前週末比195円（2%）上昇し、過去最高値（8160円）をつけた4月20日以来の水準となった。急速な円安・ドル高の進行に加え、国内外の株式相場の下落で代替資産としての需要も意識され、買いが集まった。13日の外国為替市場で円相場が一時1ドル=135円台前半と、1998年10月以来の円安・ドル...
2022-06-13 18:15:32.126224,59167,"{1.8448814153671265,2.8677992820739746,3.2066454887390137,2.093120813369751}",外国為替市場で円が13日に対ドルで下落し、およそ24年ぶりの円安水準となった。中国地方の企業からは、輸入食品や木材価格などの高騰や電気料金の上昇を懸念する声が上がる。「急激な円安は経営にとって厳しい」。合成樹脂繊維大手の萩原工業の浅野和志社長は、ブルーシートの原料のポリエチレンなどの輸入価格を押し上げるデメリットが大きいと指摘する。為替リスクや海上運賃高騰のリスクをできるだけ減らすため、生産拠...
2022-06-13 18:15:32.126224,59168,"{2.4996209144592285,2.5250110626220703,2.983065128326416,2.696244239807129}",松野博一官房長官は13日の記者会見で、国連平和維持活動（PKO）協力法について「国際社会の平和と安定に貢献し、日本の国益を増進してきた」と述べた。同法は15日に成立から30年を迎える。ロシアによるウクライナ侵攻にともなう人道支援はPKO法に基づき救援物資を輸送していると説明した。「これまでの活動実績に立ち、国際平和協力分野で一層貢献する」と強調した。
2022-06-13 18:15:32.126224,59169,"{3.355756998062134,1.684478998184204,2.509942054748535,3.4264237880706787}",JR西日本岡山支社は、7月から9月の大型観光企画「岡山デスティネーションキャンペーン」にあわせ、観光列車の運行や鉄道のしごと体験イベントなどを集中して実施する。「おか鉄フェス2022」と銘打ち、地域を盛り上げる。岡山エリアでは旧国鉄時代からの車両が多く残っており「国鉄型車両の聖地　岡山」をうたう企画も展開する。かつて運行していた急行「砂丘」や「鷲羽」をイメージしたリバイバル列車を国鉄型車両を使って特別運行する。岡山駅ビルのお土産売り場では、新たに開発したカプセルトイの「岡山おみやげコレクション」を7月から販売する。デニムのキーホルダーや備前焼のペーパースタンドなど7種類をそろえた。黒田匡喜副支社長は「全国から岡山に来ていただき、鉄道だけでなく岡山・備後地区の良いものを体験して帰ってもらいたい」と話している。
2022-06-13 18:15:32.126224,59170,"{3.2000842094421387,1.8909093141555786,2.738610029220581,3.5005006790161133}",マツダは車体に塗るボディーカラーで白系統の新色を開発した。既存の複数種類の白色に比べて、混じり気の少ない純粋な白さを表現できたという。きめ細やかな粒子と塗装した面による陰影表現を際立たせる金属の質感も実現した。今秋に国内で第1弾が発売となる中大型上級多目的スポーツ車（SUV）「ラージ商品群」を中心に展開する。新色の名前は「ロジウムホワイトプレミアムメタリック」。白色は下地が透けやすいので塗装の膜が厚くなりやすいが、新色では新開発の顔料を用いることで膜の厚さを3割薄くすることができる。資源の使用量を減らせるとともに、生産工程における二酸化炭素排出量の低減にもつながる。今秋
2022-06-13 18:15:32.126224,59171,"{2.275210380554199,3.116419792175293,2.8737974166870117,1.9670499563217163}",米国や欧州の債券市場で景気減速への警戒が高まっている。米国の2年物国債の利回りは13日、前週末から約0.2%上昇（価格は下落）し、一時3.2%台前半をつけた。14年ぶりに3%台となった10日から一段と上昇した。ドイツの2年物国債も13日に一時1%超と、約11年ぶりの水準まで上昇した。インフレを押さえ込むため米欧の中央銀行が金融引き締めを加速し、景気を冷やしかねないとの見方が強まっている。2年債...
2022-06-13 18:15:32.126224,59172,"{2.2435131072998047,2.368134021759033,2.6317198276519775,2.501586437225342}",衆院選挙区画定審議会（区割り審）は、小選挙区定数「10増10減」を反映した新たな区割り案を16日に岸田文雄首相に勧告する方針を固めた。複数の関係者が13日、明らかにした。総務省で同日に開いた会合で、実質的作業をほぼ終えた。25程度の都道府県、100以上の小選挙区が改定の対象となる方向だ。過去最大規模の見直しとなる。16日の会合は首相官邸で開催する予定。改定案の内容を最終確認した後、首相に手渡す。区割り変更は①10増10減の15都県②2020年国勢調査で「1票の格差」2倍以上の選挙区がある大阪府と福岡県③21年の衆院選の当日有権者数で、格差2倍以上の選挙区があった北海道と兵庫県―の19都道府県で実施するのが確定した。このほか、一つの区市町村が複数の選挙区に分割されている例をなるべく解消する方針だ。区割り審は実際の作業を始めるに当たり、都道府県の意見をヒアリング。区割りを決める際の基本ルールとなる「作成方針」を2月に決め、具体的な検討を進めてきた。〔共同〕
2022-06-13 18:15:32.126224,59173,"{1.932908296585083,3.2277345657348633,3.176737070083618,1.9471746683120728}",中国企業の米上場問題を巡って米中の神経戦が続いている。米証券取引委員会（SEC）による新規則導入から約半年間で、ネット検索最大手の百度（バイドゥ）など150社が「上場廃止警告リスト」に入った。全上場企業の6割に相当する。当局は混乱回避に向けて協議を続ける一方、米議会は上場廃止時期を2023年に早めようとしている。資本市場の分断（デカップリング）は着実に進んでいる。SECは米議会で20年12月に...
2022-06-13 18:15:32.126224,59174,"{1.7612907886505127,3.9522860050201416,3.487938404083252,2.1689889430999756}",開始から3カ月半となるロシア軍のウクライナ侵攻は、同国東部を中心に激しい攻防が続く。米欧の兵器提供が今後も続けばウクライナ軍の巻き返しが広がりそうだが、米欧の「支援疲れ」が顕在化すれば、軍隊の規模で勝るロシア軍が優勢に転ずる可能性もある。「敵は火力で大きく上回り、ウクライナ軍を押している」。東部ルガンスク州のガイダイ州知事は13日、SNS（交流サイト）で訴えた。12日にはロシア軍が一両日中に全...
2022-06-13 18:15:32.126224,59175,"{2.8736228942871094,2.6231167316436768,2.8716328144073486,3.1589298248291016}",【バンコク=村松洋兵】オースティン米国防長官は13日、訪問先のタイ・バンコクでプラユット首相兼国防相と会談した。タイ国防省によると両氏はサイバーや宇宙の分野での協力について合意した。オースティン氏は米国がタイ国軍の近代化を支援することを約束したという。米国はタイ国軍の訓練や装備の近代化を支援するほか、タイの防衛産業の発展についても協力する。米国とタイが毎年共催している多国間合同軍事演習「コブラゴールド」で、2023年にサイバーと
2022-06-13 18:15:32.126224,59176,"{2.53482723236084,2.3387820720672607,2.6925833225250244,2.9786152839660645}",【ジュネーブ=細川倫太郎】世界貿易機関（WTO）で電子商取引（EC）のルールづくりを進める日本などの共同議長国は13日、閣僚声明を公表した。電子データに関税をかけない慣行の継続を支持したほか、早期の合意に向け交渉を加速させることを確認した。日本とオーストラリア、シンガポールが共同議長国となって、ロシアを含めた計86カ国・地域の有志国がデータの自由な流通に向け議論を進めている。ただ、ウクライナ侵攻で予定していた会合が延期になるなど、交渉が遅れる懸念が強まっている。声明はデジタル分野で途上国を支援する枠組みを創設することにも触れた。スイス・ジュネーブで開催中のWTOの閣僚会議に参加した三宅伸吾外務政務官は13日、記者団に電子データに関税をかけないことは「産業界の期待に応えるために必要なものだ」と語った。
2022-06-13 18:15:32.126224,59177,"{2.00197434425354,1.996553897857666,1.958189606666565,2.238862991333008}",日銀（13日）検査役検査室長（金融機構局審議役兼金融機構局上席考査役）山口智之▽金融機構局審議役、金沢敏郎▽業務局審議役（調査統計局参事役）佐久田健司▽調査統計局参事役（フランクフルト事務所長）福永一郎▽考査運営課長兼金融機構局上席考査役、山田哲也▽フランクフルト事務所長、片岡雅彦（20日）総務人事局長（総務人事局審議役）播本慶子▽検査室検査役（松江支店長）谷本英行▽政策委員会室審議役（企画局審議役）福田英司▽総務人事局審議役（決済機構局審議役）奥野聡雄▽企画局審議役（鹿児島支店長）上條俊昭▽金融機構局審議役（福島支店長）植田リサ▽決済機構局審議役（金融機構局審議役）鈴木公一郎▽国際局審議役（仙台支店長）大山慎介▽金融機構局参事役（決済機構局参事役）森毅▽同（金融第2課長）今久保圭▽決済機構局参事役（高知支店長）中山智裕▽調査統計局参事役（青森支店長）森本喜和▽国際局参事役（情報サービス局総務課長）上原博人▽総務人事局参事役、土居直彦▽金融研究所参事役（大分支店長）鈴木淳人▽金融機構局上席考査役（金融機構局審議役）新見明久▽政策委員会室総務課長（法務課長）伊藤真▽広報課長、小島亮太▽法務課長、高橋治大▽経営企画課長（金融第3課長）安徳久仁理▽金融機構局総務課長（経営企画課長）広瀬敬久▽金融第2課長、荒川和彦▽金融第3課長、井出穣治▽国際課長、吉村研太郎▽金融システム調査課長、平形尚久物価統計課長、東将人▽国際収支課長、森下謙太郎▽発券局総務課長（国際収支課長）森下浩文▽業務局総務課長（制度基盤研究課長）真川伸樹▽国庫業務課長、笠間兵庫▽情報サービス局総務課長（広報課長）横堀裕二▽総務人事局総務課長（文書局総務課長）大塚竜▽人材開発課長、田原謙一郎▽文書局総務課長（管財課長）辻信二▽管財課長、柳井聡史▽物品課長（歴史研究課長）本山俊輔▽管理課長（物品課長）小野寺拓▽経済ファイナンス
2022-06-13 18:15:32.126224,59178,"{1.8598618507385254,3.1114001274108887,3.1557979583740234,1.8893808126449585}",13日の外国為替市場で円相場は一時、1ドル=135円台前半と約24年ぶりの円安・ドル高水準をつけ、関西でも円安への警戒感がじわり高まっている。円安は輸出や観光関連企業にとって追い風となる一方、原材料価格の高騰に苦しむ企業の業績には下押し圧力がかかる。製造業でもシャープは主力の白物家電で収益が悪化するなど影響が出ている。パナソニックホールディングス（HD）では、2023年3月期にドルに対して1円...
2022-06-13 18:15:32.126224,59179,"{1.9265471696853638,1.9077545404434204,2.0053086280822754,2.1484198570251465}",警察庁（27日）官房参事官、池内久晃
2022-06-13 18:15:32.126224,59180,"{2.0507073402404785,2.5653204917907715,2.5450382232666016,2.2362399101257324}",「岸田政権は新型コロナウイルス対策などで結論を出さない。（対策を）ちょっとずつ進めている。対立軸が明確にならない」（2022年6月13日、大阪府庁で記者団に）日本維新の会の吉村洋文副代表（大阪府知事）は参院選を前にした自民党対策について答えた。維新は参院選の公約で憲法9条への自衛隊明記など保守層を狙った項目を並べた。一方で「街頭演説で一生懸命言うわけではない」とも話した。「自民党との対立軸が重要だが国防の観点では似ている。自民とどこが違うのかと思われるのではないか」と述べた。維新は次の衆院選で野党第1党の座をめざす。野党で地歩
2022-06-13 18:15:32.126224,59181,"{2.905951499938965,1.9821423292160034,2.765272378921509,2.8536314964294434}",東京五輪・パラリンピックを契機とした共生社会の実現に向け、日本オリンピック委員会（JOC）は13日、LGBTQ＋（性的少数者）の情報発信拠点「プライドハウス東京」と包括協定を締結したと発表した。東京都内で行われた署名式に参加したJOCの山下泰裕会長は「東京五輪でLGBTQ＋を公表したアスリートは過去最多だった。レガシー（遺産）として引き継ぐにはスポーツ界で理解を深めることが重要で、力添えをいただきながら実践していきたい」と語った。7月中にもJOC役職員向けに「性の多様性」を学ぶ研修を行う予定。プライドハウス東京は競技団体向けの研修や、理解を広げるイベント開催に力を入れている。運営組織の松中権代表は「スポーツ界にも支援の輪が広がることに尽力していきたい」と話した。〔共同〕
